{
  "$schema": "../../../tools/schemas/fable2-gpu-boundary-assessment-v1.schema.json",
  "schema_version": "1.0.0",
  "corpus": "Fable II Native Renderer G1.5D",
  "generated_on": "2026-09-01",
  "pins": {
    "fable_commit": "3cef954120e062974f3fcdf707ac302aa0e2d44e",
    "g1_commit": "c44e8c16f4422f9a828caf30899ac989170b8a8c",
    "paused_g2a_commit": "47c2ea2b7d9e14b09fd942c4b5f1bd11c46e2f51",
    "rexglue_commit": "956c6a8b5da4c54b9899a2593e9c67c26de30194",
    "active_dll_sha256": "8232051BED6E5CE99CF37B2EF581C824F58875C140A4D3C75DE14E8A5DF4AA99"
  },
  "purpose_definitions": {
    "transparent_forwarding_mechanism_proof": "Can an exact call be wrapped and forwarded once without changing guest-visible behaviour?",
    "presentation_frame_correlation": "Can title swap/frame identity be joined to mailbox and host Present without claiming draw provenance?",
    "draw_resource_defect_diagnosis": "Does the boundary retain enough draw, register, shader, binding, texture, EDRAM and outcome state to discriminate a defect?",
    "eventual_renderer_replacement": "Could the boundary express and own renderer operations without recreating the entire GPU ABI or creating dual ownership?"
  },
  "boundaries": [
    {
      "boundary_id": "G1-HOOK-82AAC208",
      "origin": "G1_CANDIDATE",
      "g1_candidate_address": "0x82AAC208",
      "exact_address_or_symbol": "sub_82AAC208 0x82AAC208 [0x82AAC208, 0x82AAC54C) size 0x344",
      "source_location": "docs/fable2-native-renderer/candidate-hook-inventory.json",
      "inputs": [
        "Object-like r3 and queue-owned state; exact ABI unknown."
      ],
      "outputs": [
        "Consumes or advances one or more async queues; exact result unknown."
      ],
      "persistent_state": [
        "Lionhead queues, synchronization and ownership are unresolved."
      ],
      "threading": "Unknown Lionhead worker/queue context; queue thread, producer threads and re-entry are not statically proved.",
      "semantics_retained": [
        "Potential Lionhead command grouping and queue timing label."
      ],
      "semantics_lost": [
        "Static Xbox D3D method identities and packet-level outcomes remain unknown."
      ],
      "existing_fable_evidence": [
        "exact TU1 generated ReXGlue body: 209 PPC instructions",
        "TU1 string reference at 0x82AAC254 to ProcessAsyncCommandQueues timing label",
        "exact-image Ghidra data reference at 0x82AAA2E8",
        "Ghidra .pdata record 0x82133E70"
      ],
      "side_effects": [
        "May consume multiple queues, mutate queue ownership, signal synchronization, or recurse into Xbox graphics methods. Hook only after thread/order behaviour is traced."
      ],
      "forwarding_feasibility": "conditional",
      "observation_value": "A proven semantic command ABI could preserve title intent, but no command layouts are known.",
      "replacement_value": "Potentially valuable only after static ABI, threading and coverage proof.",
      "evidence_required": "The title-owned diagnostic label identifies queue processing; no evidence yet proves this function is the enqueue boundary or that commands preserve D3D semantics.",
      "purposes": {
        "transparent_forwarding_mechanism_proof": {
          "value": "LOW",
          "rationale": "Queue ABI, ownership, threading, recursion and coverage are unproved."
        },
        "presentation_frame_correlation": {
          "value": "LOW",
          "rationale": "The queue has no confirmed one-command-per-frame or present mapping."
        },
        "draw_resource_defect_diagnosis": {
          "value": "MEDIUM",
          "rationale": "A proven semantic command ABI could preserve title intent, but no command layouts are known."
        },
        "eventual_renderer_replacement": {
          "value": "UNKNOWN",
          "rationale": "Potentially valuable only after static ABI, threading and coverage proof."
        }
      },
      "stage_disposition": "STATIC METHOD RECOVERY TARGET",
      "related_divergence_ids": [],
      "experiment_ids": [
        "EXP-STATIC-XDK-001"
      ]
    },
    {
      "boundary_id": "G1-HOOK-82B6EA60",
      "origin": "G1_CANDIDATE",
      "g1_candidate_address": "0x82B6EA60",
      "exact_address_or_symbol": "sub_82B6EA60 0x82B6EA60 [0x82B6EA60, 0x82B6EBC0) size 0x160",
      "source_location": "docs/fable2-native-renderer/candidate-hook-inventory.json",
      "inputs": [
        "Title graphics creation inputs and globals."
      ],
      "outputs": [
        "Initialized device path or failure."
      ],
      "persistent_state": [
        "Global title device publication and lifecycle."
      ],
      "threading": "Guest initialization context; host GPU command and vblank threads are downstream owners.",
      "semantics_retained": [
        "Title creation orchestration."
      ],
      "semantics_lost": [
        "Per-operation rendering semantics."
      ],
      "existing_fable_evidence": [
        "exact TU1 generated ReXGlue body: 88 PPC instructions",
        "directly calls sub_82B6F6C0",
        "later invokes the presentation path"
      ],
      "side_effects": [
        "Global device publication, ownership, initial presentation, and failure cleanup must remain byte-for-byte guest behaviour."
      ],
      "forwarding_feasibility": "yes",
      "observation_value": "No per-draw/resource state remains.",
      "replacement_value": "Useful lifecycle context, insufficient rendering operation coverage.",
      "evidence_required": "It is above Vd/ring setup and coordinates title state, but could be a Fable wrapper rather than the Xbox CreateDevice implementation.",
      "purposes": {
        "transparent_forwarding_mechanism_proof": {
          "value": "MEDIUM",
          "rationale": "A lifecycle wrapper is feasible but does not prove draw forwarding."
        },
        "presentation_frame_correlation": {
          "value": "LOW",
          "rationale": "Creation is not a recurring frame boundary."
        },
        "draw_resource_defect_diagnosis": {
          "value": "NONE",
          "rationale": "No per-draw/resource state remains."
        },
        "eventual_renderer_replacement": {
          "value": "LOW",
          "rationale": "Useful lifecycle context, insufficient rendering operation coverage."
        }
      },
      "stage_disposition": "REJECT AS PRIMARY SEAM",
      "related_divergence_ids": [],
      "experiment_ids": [
        "EXP-STATIC-XDK-001"
      ]
    },
    {
      "boundary_id": "G1-HOOK-82B6F6C0",
      "origin": "G1_CANDIDATE",
      "g1_candidate_address": "0x82B6F6C0",
      "exact_address_or_symbol": "sub_82B6F6C0 0x82B6F6C0 [0x82B6F6C0, 0x82B6F9CC) size 0x30C",
      "source_location": "docs/fable2-native-renderer/candidate-hook-inventory.json",
      "inputs": [
        "Title initialization inputs."
      ],
      "outputs": [
        "0x5E80-byte device-like object and initialization result."
      ],
      "persistent_state": [
        "Allocated object and 0x7C-byte initialization/presentation block."
      ],
      "threading": "Guest initialization context; host GPU command and vblank threads are downstream owners.",
      "semantics_retained": [
        "Title object allocation and init ordering."
      ],
      "semantics_lost": [
        "Draw/resource operations."
      ],
      "existing_fable_evidence": [
        "exact TU1 generated ReXGlue body: 195 PPC instructions",
        "allocates 0x5E80 bytes",
        "passes the object and a 0x7C-byte initialization/presentation block to sub_82BA6990",
        "Ghidra .pdata record 0x82136A80"
      ],
      "side_effects": [
        "Allocation identity, constructor ordering, virtual/function tables, reference counts, and failure cleanup must be preserved."
      ],
      "forwarding_feasibility": "yes",
      "observation_value": "No draw/resource operations are exposed.",
      "replacement_value": "Object layout evidence may help integration but not rendering replacement.",
      "evidence_required": "Allocation size, downstream Vd initialization, and title creation flow distinguish it from a small thunk; the exact XDK API name is unconfirmed.",
      "purposes": {
        "transparent_forwarding_mechanism_proof": {
          "value": "MEDIUM",
          "rationale": "The allocation/init bridge can be forwarded but validates only lifecycle mechanics."
        },
        "presentation_frame_correlation": {
          "value": "NONE",
          "rationale": "Not a frame boundary."
        },
        "draw_resource_defect_diagnosis": {
          "value": "NONE",
          "rationale": "No draw/resource operations are exposed."
        },
        "eventual_renderer_replacement": {
          "value": "LOW",
          "rationale": "Object layout evidence may help integration but not rendering replacement."
        }
      },
      "stage_disposition": "REJECT AS PRIMARY SEAM",
      "related_divergence_ids": [],
      "experiment_ids": [
        "EXP-STATIC-XDK-001"
      ]
    },
    {
      "boundary_id": "G1-HOOK-82B6FA48",
      "origin": "G1_CANDIDATE",
      "g1_candidate_address": "0x82B6FA48",
      "exact_address_or_symbol": "sub_82B6FA48 0x82B6FA48 [0x82B6FA48, 0x82B6FBE0) size 0x198",
      "source_location": "docs/fable2-native-renderer/candidate-hook-inventory.json",
      "inputs": [
        "Global device, referenced front-buffer/surface-like object and related title state."
      ],
      "outputs": [
        "Presentation result and reference/lifetime updates."
      ],
      "persistent_state": [
        "Title object references and presentation coordination."
      ],
      "threading": "Guest calling thread; downstream VdSwap publishes work consumed by the host GPU/presenter path.",
      "semantics_retained": [
        "Title-level device/front-buffer meaning."
      ],
      "semantics_lost": [
        "Contributing draws, shaders, resources and EDRAM passes."
      ],